"","headverb_person","number_of_paragraphs","asuminen_expressed","indicatorword_token","indicatorloc","textid","indicatorword","words_total","headverb_lemma","sentence","paragraph","sentence_number","head_of_indicator","first_word_of_sentence_lemma","featmean","head_of_indicator_loc","headverb_feat","indicatorwords","first_word_of_sentence_token","indicator_ratio","headverb_person_simple","indicatorword_length"
"96","Sing.3",4,"conj","","7",204,"asua",82,"herätä","Monella varmaan herää jo kysymys, entäs asuminen?","Monella varmaan herää jo kysymys, entäs asuminen? Itse olin katsellut Granadan vaihtariryhmien erilaisilta Facebook -sivuilta (esim. Erasmus Granada jne.) asuntoja jo etukäteen ennen vaihtoon lähtemistä. Kämppätarjonta on Granadassa (kuten yleisestikin Espanjassa) erittäin runsasta, eikä sen löytymisen suhteen tarvitse siis panikoda. Juttelin muutamien ihmisten kanssa facebookin ja whatsapin välityksellä ja lopulta sovin alustavasti itselleni huoneen 4 hengen asunnosta noin viikkoa ennen vaihtoonlähtöäni. Moni vaihtarikaverini kuitenkin teki niin, että saapui Granadaan muutamaksi päiväksi hostelliin ja kävi sitten paikanpäällä katsomassa asuntoja. Suosittelen jälkimmäistä vaihtoehtoa lämpimästi.",1,"kysymys","moni",2.42857142857143,"5","Mood=Ind|Number=Sing|Person=3|Tense=Pres|VerbForm=Fin|Voice=Act",4,"Monella",4.9,"3p",0
"97","--",1,"nmod","","2",205,"asunto",112,"luksus","Espanjan asuntoihin verrattuna talot Suomessa ovat luksusta.","Espanjan asuntoihin verrattuna talot Suomessa ovat luksusta. Talvella asunnot ovat jääkylmiä, usein sisällä saattaa olla kylmempi kuin kaduilla. Itse vilukissana pärjäsin talven ylin sängyn vieressä olevan patterin avulla, mutta talojen huono eristys yllätti. Talvella myös täälläkin tarvitsee kunnon takkia ja lämpimiä vaatteita - itse lähdin Suomesta pelkästäään kesävaatteiden kera. Kesällä ongelma on päinvastainen – asunnoissa on joskus tuskaisen kuuma ja nukkuminen voi olla vaikeaa. Sekä patteri että tuuletin voivat olla hyviä investointeja. Muutoin sää on miellyttävä etenkin syksyllä ja keväällä, kesät ovat kuitenkin paljon kuumempia kuin Suomessa. Kesäkuun lämpötila on noin 30-40 asteen välillä ja heinä-elokuussa voi olla reilusti yli neljäkymmentä astetta. Kaupungin keskusta tyhjenee opiskelijoista ja turisteista ja kaupunkiin jääneet pakoilevat kuumuutta sisätiloissa.",1,"verrata","Espanja",3.14285714285714,"3","Case=Par|Number=Sing",3,"Espanjan",2.7,"--",0
"98","Sing.1",2,"root","","1",206,"asua",64,"asua","Asuin ensimmäiset päivät hostellissa ja kävin katsomassa muutamaa kämppää, joiden katsomisesta olin sopinut etukäteen facebookissa.","Asuin ensimmäiset päivät hostellissa ja kävin katsomassa muutamaa kämppää, joiden katsomisesta olin sopinut etukäteen facebookissa. Itse suosittelen kämpän hankkimista vasta paikan päältä käsin, sillä netin perusteella ei voi päätellä haiseeko kämppä tai voisiko tulevien kämppisten kanssa tulla toimeen. Lisäksi yleinen hintataso ja kaupungin välimatkat konkretisoituvat paikan päältä käsin. Ne, jotka kämpän olivat hankkineet etukäteen eivät välttämättä loppujen lopuksi olleet tyytyväisiä asunnon hintaan tai sijantiin.",1,"","asua",3.4,"","Mood=Ind|Number=Sing|Person=1|Tense=Past|VerbForm=Fin|Voice=Act",2,"Asuin",3.1,"1p",0
"99","--",2,"nmod:gobj","","6",209,"asunto",149,"etsiä","Granadaan tullessa ensimmäinen askel oli asunnon etsiminen.","Granadaan tullessa ensimmäinen askel oli asunnon etsiminen. Minulla oli kyllä tuutori, mutta hän ei ollut kaupunkiin saapuessani vielä Granadassa, eikä hänestä kyllä ollut mitään apua Granadaan tultuakaan. Vapaan asunnon löytäminen Granadassa osoittautui todella helpoksi: asuntotarjouksia oli koko kaupunki täynnä! Tämä johtui ainakin osittain siitä että tulin Granadaan jo elokuun viimeisinä päivinä ja opiskelijat saapuvat kaupunkiin vasta syyskuun aikana. Kuitenkin oli ajankohta mikä tahansa Granadasta asunnon löytäminen on hyvin helppoa. Olin varannut hostellin ensimmäiseksi viikoksi, mutta löysin sopivan asunnon jo neljäntenä päivänä. Vuokrani kielitieteen laitoksen viereisessä rakennuksessa aivan kaupungin keskustassa oli 200 euroa pienestä huoneesta viiden hengen asunnossa. Kämppikseni olivat muuttohetkellä espanjalaisia, mutta vuotta myöhemmin he olivat kaikki vaihtuneet. Laskuihin meni yhteensä 30-70 euroa kuussa vuodenajasta riippuen. Asuntoa hakiessa kannattaa kysyä, saisiko nähdä sähkölaskun, jossa näkyy koko vuoden sähkön kulutus. Asuntoa etsiessä on erityisen tärkeää kiinnittää huomiota lämmitykseen ja ikkunoiden tiivistykseen; Granadassa tulee talvella kylmä ja sähkölämmitys on kohtuuttoman kallis.",1,"etsiä","Granadaan",3.28571428571429,"7","Case=Nom|Derivation=Minen|Number=Sing",7,"Granadaan",4.7,"--",0
"100","Sing.3",2,"nmod","","18",210,"asunto",115,"olla","Kun saavuin Madridiin elokuun lopussa, minulla oli noin viisi hostelliyötä varattuna ja rahaa taskussa, mutta ei tietoa asunnosta, liittymästä tai oikeastaan edes yliopiston sijainnista.","Kun saavuin Madridiin elokuun lopussa, minulla oli noin viisi hostelliyötä varattuna ja rahaa taskussa, mutta ei tietoa asunnosta, liittymästä tai oikeastaan edes yliopiston sijainnista. Autónomasta ei tarjottu erityisesti apua asunnon hankkimiseen, mutta he tarjoavat kyllä yliopistoresidenssiä, joka on kampuksella, eli keskellä ei-mitään, ja myös suhteellisen kallis. Yksi Erasmus-kavereistani asui siellä vaihtonsa ensimmäiset puoli vuotta, kunnes kyllästyi olemaan kaukana kaikesta, ja muutti yksityiselle keskustaan. Madrid on täynnä vuokra-asuntoja ja -huoneita, mutta se on myös täynnä vaihto-opiskelijoita, joten varaudu olemaan päämäärätietoinen ja nopea asunnon etsimisessä. Tärkeimpinä vinkkeinä suosittelen ostamaan paikallisen SIM-kortin ja (prepaid)liittymän, ja hankkiutumaan esimerkiksi Idealista -sivustolle. Soita suoraan vuokranantajalle - sähköpostin tai viestin jättäminen on yleensä yhtä tyhjän kanssa, kun kaupunki kuhisee kattoa vailla olevia opiskelijoita.",1,"tieto","kun",2.45833333333333,"17","Mood=Ind|Number=Sing|Person=3|Tense=Past|VerbForm=Fin|Voice=Act",4,"Kun",3.5,"3p",0
"101","Sing.1",2,"root","","3",211,"asua",70,"asua","Kuten mainitsin, asuin ensimmäiset päivät keskustan hostellissa, jonka olin varannut Suomesta etukäteen.","Kuten mainitsin, asuin ensimmäiset päivät keskustan hostellissa, jonka olin varannut Suomesta etukäteen. Sanottakoon, että Madridissa hyvän hintatason omaavia hostelleja on keskustassa vähintään 2-3 joka kadulla ja melkein jokainen kaupunkiin saapuva opiskelija asuu ensimmäiset päivänsä hostellissa, joten kämpän etsintää paikan päällä ei kannata pelätä. Ajattelin, että nopeat syövät hitaat ja kämppä täytyisi löytää mahdollisimman nopeasti, mutta tämä luulo osoittautui vääräksi, koska vuokrakämppien hintataso laski opiskeluiden alettua tarjonnan pysyessä suurin piirtein samana.",1,"","kuten",3.33333333333333,"","Mood=Ind|Number=Sing|Person=1|Tense=Past|VerbForm=Fin|Voice=Act",2,"Kuten",2.9,"1p",0
"102","--",2,"dobj","","16",212,"asunto",98,"katsoa","Olin katsonut Couch Surfing palvelut Renting rooms in Madrid( tai jokin vastaavan niminen) -palstalta sopivan asunnon etukäteen ja jutellut omistajan kanssa netissä.","Olin katsonut Couch Surfing palvelut Renting rooms in Madrid (tai jokin vastaavan niminen) -palstalta sopivan asunnon etukäteen ja jutellut omistajan kanssa netissä. Saavuttuani Madridiin kävin katsomassa asunnon ja tapaamassa vuokraemäntääni, joka oli myös kämppikseni. Suosittelen muillekin seuraamaan ainakin tuota asuntopalstaa, Idealista-nimisen verkkopalvelun tarjoamia asuntoja ja tarvittaessa myös milanuncios-palstaa. Madridissa on muutamakin firma, jotka välittävät asuntoja erityisesti opiskelijoille. Niillä siis vuokranantajat ovat yksityisiä. Itse maksoin pienestä mutta siististä huoneesta 400 euroa kuussa, vuokra sisälsi veden, sähkön netin ja kaikki muut kulut (gastos). Kannattaa katsoa, sisältyvätkö kulut vuokraan (gasto incluido(s). Niistä voi helposti tulla n. 50 € kuussa vuokran päälle.",1,"sopia","olla",2.54545454545455,"15","Case=Nom|Degree=Pos|Number=Sing|PartForm=Past|VerbForm=Part|Voice=Act",4,"Olin",4.1,"--",0
"103","--",1,"nsubj","","7",213,"asunto",139,"olla","Espanjaan saapuessani minulla ei vielä ollut asuntoa, vaan majailin viikon hostellissa.","Espanjaan saapuessani minulla ei vielä ollut asuntoa, vaan majailin viikon hostellissa. Etsin erinäisiltä sivustoilta (mm. idealista, milanuncios) asuntoja. Tähänkin hommaan olisi tarvittu parempi espanjan taito. Mutta sain kuin sainkin sovittua itselleni asuntonäyttöjä. Madridin vuokrataso on muihin Espanjan kaupunkeihin verrattuna korkea, eikä hintalaatusuhde kovinkaan usein ole kohdillaan. Esimerkiksi ikkunattomasta asunnosta seitsemällä kämppiksellä saattaa joutua pulittamaan jopa lähemmäs 400 euroa. Minulla kävi tuuria ja löysin aivan Madridin ydinkeskustasta suhteellisen hyväkuntoisen kämpän alle neljälläsadalla ja neljällä ihanalla espanjalaisella kämppiksellä. Itse asuin Plaza de Españalla. Jos lähtisin uudelleen, etsisin kämppää varmaan Malasañan, La Latinan, Chuecan tai Lavapiesin alueelta. Ne ovat nimittäin tunnelmaltaan aivan ihania alueita. Vinkkinä sanon sen, että kannattaa valita sellainen asunto, jonka vuokraan kuuluu kaikki laskut (gastos incluido). Espanjassa sähkö on kalliimpaa kuin Suomessa, ja jos etukäteen on sovittu sidottu hinta kaikille laskuille, ei talvikuukausina tule yllättäviä hyppyjä vuokran hinnassa ylöspäin.",1,"olla","Espanja",3.45454545454545,"6","Case=Nom|Degree=Pos|Number=Sing|PartForm=Past|VerbForm=Part|Voice=Act",5,"Espanjaan",3.6,"--",0
"104","--",1,"nmod","","14",214,"asunto",181,"saada","Olin saanut sovituksi huoneen kimppakämpästä jo Suomesta käsin, mutta lopulta en kuitenkaan viihtynyt asunnossa.","Olin saanut sovituksi huoneen kimppakämpästä jo Suomesta käsin, mutta lopulta en kuitenkaan viihtynyt asunnossa. Oviedon kostea meri-ilmasto tekee asunnoista erittäin kalseita varsinkin talvella, mistä syystä en pystynyt jäämään asuntoon, jonka vanhassa rakennuksessa ei ollut erillistä lämmitystä talven varalle ja seinässä oli home-esiintymiä. Uuden asunnon löytäminen osoittautui kuitenkin erittäin helpoksi, sillä tarjontaa on ja etenkin isoja asuntoja löytyy paljon kimppakämppämuotoiseen asumiseen. Näytön jälkeen pääsinkin muuttamaan jo seuraavana päivänä. Netistä löytyy useita sivustoja, joista asuntoja voi bongailla (idealista, oviedopiso, pisocompartido…). Parhaiten yhteyden vuokranantajaan saa soittamalla. Itse asuin keskustassa, josta oli hyvät kulkuyhteydet kaikkialle. Liiketalouden kampus El Cristo on kuitenkin hieman syrjässä, minkä vuoksi kuljin luennoille paikallisbussilla. Suosittelen etsimään asuntoa keskeiseltä sijainnilta, sillä etenkin El Cristo on alueena hieman nuhjuinen eikä sisällä hirveästi kauppoja tai ravintoloita. Lisäksi siirtyminen erilaisista tapahtumista ja illanvietoista voi olla hieman vaivalloista, sillä nämä ovat keskittyneet keskusta-alueelle. Huoneiden vuokrat vesi, sähkö ja internet mukaan luettuna, olivat keskustan välittömässä läheisyydessä 200-250 euron luokkaa. Suosittelen jokaista Oviedoon lähtevää majoittautumaan pariksi yöksi hotelliin ja etsimään asunnon paikan päältä, sillä näin välttyy ikäviltä yllätyksiltä. Kalustettujen asuntojen tarjontaa on niin paljon, ettei kukaan jää ilman.",1,"viihtyä","olla",3,"13","Case=Nom|Degree=Pos|Number=Sing|PartForm=Past|VerbForm=Part|Voice=Act",11,"Olin",6.1,"--",0
"105","Sing.1",1,"dobj","","3",215,"asunto",127,"löytää","Itse löysin asunnon jo ennen vaihtoon lähtöä yliopiston sivujen vuokrailmoituksista, ja päätin luottaa siihen että perille päästyäni kaikki on niin kuin pitää.","Itse löysin asunnon jo ennen vaihtoon lähtöä yliopiston sivujen vuokrailmoituksista, ja päätin luottaa siihen että perille päästyäni kaikki on niin kuin pitää. Suurin osa vaihtareista majoittui ensin hostelliin ja etsi asunnon vasta paikanpäällä. Voisin sanoa, että itselläni kävi erinomainen tuuri asunnon suhteen. Vuokraemäntäni haki minut rautatieasemalta ja huolehti ensimmäisen päivän syömisistäni. Seuraavana päivänä hän kuskasi minua kaupoille, jotta pääsisin alkuun. Jaoin asuntoni paikallisten kanssa, mikä auttoi sekä kielen että ympäristön haltuunotossa. Olin opiskellut espanjaa jo enemmän tai vähemmän satunnaisesti lukiosta asti, joten ymmärsin puhetta ja pystyin jo kommunikoimaan jotenkuten, mutta käytännössä puhuminen oli vielä erittäin väkinäistä. En kuitenkaan osallistunut ylimääräisille kielikursseille, sillä tunnit menivät usein päällekkäin muun opetuksen kanssa ja tietysti maksoivat melkoisesti. Muilta vaihtareilta kuulin myös, että eri tasojen ryhmiä opetettiin samaan aikaan, mikä haittasi oppimista.",1,"löytää","itse",2.81818181818182,"2","Mood=Ind|Number=Sing|Person=1|Tense=Past|VerbForm=Fin|Voice=Act",4,"Itse",3.1,"1p",0
"106","Sing.1",2,"dobj",";asunnon","1",217,"asunto",16,"hommata","Asuntoni hommasin etukäteen, mutta käsittääkseni suurin osa löysi asunnon helposti paikan päältä Santiagon vaihtareiden Facebook-ryhmästä, joka on täynnä kämppäilmoituksia.","Asuntoni hommasin etukäteen, mutta käsittääkseni suurin osa löysi asunnon helposti paikan päältä Santiagon vaihtareiden Facebook-ryhmästä, joka on täynnä kämppäilmoituksia. Asuntoni oli vain muutaman minuutin päässä Campus Nortesta, jossa sijaitsee viestinnän laitos ja myös kielitieteiden laitos, jossa minulla oli muut kurssit. Matkaa Zona Viejaan, eli keskustaan oli noin 20 minuuttia. Yliopiston laitoksia on ympäri kaupunkia useita, suurin osa niistä on Campus Surilla, jonne on matkaa Nortesta noin puoli tuntia. Campus Sur on vain noin kymmenen minuutin päässä keskustasta, joten suurin osa asuikin siellä, vaikka opiskeli Nortessa.",1,"hommata","asunto",2.84210526315789,"2","Mood=Ind|Number=Sing|Person=1|Tense=Past|VerbForm=Fin|Voice=Act",0,"Asuntoni",0,"1p",8
"107","Sing.3",1,"xcomp:ds","","4",218,"asua",107,"kannattaa","Monien mielestä kannattaa asua uuden kaupungin alueella lähempänä eteläkampusta, vaikka opiskelisikin pohjoisessa, sillä siellä on enemmän yöelämää.","Kampuksia Santiagosta löytyy kaksi, Campus Sur ja Campus Norte. Niiden lisäksi osa tiedekunnista on siroteltuna kaupungilla. Monien mielestä kannattaa asua uuden kaupungin alueella lähempänä eteläkampusta, vaikka opiskelisikin pohjoisessa, sillä siellä on enemmän yöelämää. Esimerkiksi miltei kaikki paikallisen ESN:n tapahtumat järjestetään siellä. Pohjoiskampuksen liepeillä onkin hyvin rauhallista, mutta Santiago on toisaalta niin pieni, että mielestäni asialla ei ole hirveän suurta merkitystä. Itse löysin asunnon ESN:n facebook-ryhmän kautta vanhasta kaupungista. Se on lähempänä pohjoiskampusta, mutta aivan uuden kaupungin vieressä. Mielestäni sijainti oli täysin ihanteellinen, sillä vanhassa kaupungissa on upea tunnelma, ja sieltä pääsee nopeasti joka puolelle. Sen lisäksi siellä on paljon ravintoloita, kahviloita ja pubeja, joten yöelämää riittää sielläkin.",3,"kannattaa","moni",2.6969696969697,"3","Mood=Ind|Number=Sing|Person=3|Tense=Pres|VerbForm=Fin|Voice=Act",2,"Monien",1.9,"3p",0
"108","--",1,"dobj","","1",219,"asunto",120,"olla","Asuntoa minulla ei ollut valmiina Sevillaan saapuessani.","Asuntoa minulla ei ollut valmiina Sevillaan saapuessani. Päädyin ottamaan asuntoni Roommates Sevilla -nimisen välitysfirman kautta. Asuin kolmen muun kansainvälisen opiskelijan kanssa yhteisessä asunnossa aivan Sevillan keskustassa lähellä Prado de San Sebastian -metroasemaa. Asunto kannattaakin mielestäni hankkia läheltä metroa, sillä UPO:on mentäessä on liikuttava metrolla. Vuokrani oli 260 euroa kuussa ja tähän päälle muut kulut 30 euroa kuussa. Vuokrataso Sevillassa on matala, ja olisinkin varmasti saanut huoneen vuokrattua huomattavasti halvempaankin hintaan yksityisen vuokraajan kautta. Koin asunnon etsimisen itsenäisesti kuitenkin hankalasti, sillä huonohko espanjan kielen taitoni vaikeutti yksityisten vuokraajien kanssa kontaktissa oloa. Paras asuinalue on mielestäni kaupungin keskusta, erityisesti Prado de San Sebastianin alue, mutta myös Trianassa, eli joen toisella puolella asui paljon vaihtareita. Siellä vuokrat ovat useasti edullisempia kuin aivan keskustassa.",1,"saapua","asunto",4.28571428571429,"7","Case=Nom|Degree=Pos|Number=Sing|PartForm=Past|VerbForm=Part|Voice=Act",7,"Asuntoa",5.8,"--",0
"109","--",1,"dobj","","1",220,"asunto",21,"olla","Asuntoa minulla ei ollut valmiiksi, mutta kämppäkaverit olivat.","Asuntoa minulla ei ollut valmiiksi, mutta kämppäkaverit olivat. Suosittelen kämppien katselua etukäteen ja ottamista yhteyttä vaikkapa Roommates Sevillaan. Se on hieman kalliimpi kuin yksityinen, mutta varma ja helppo tapa järjestää asuminen. Voit myös kommunikoida englanniksi, mikäli et osaa espanjaa. Monet yksityiset vuokranantajat eivät puhu englantia juurikaan. Jos etsit asuntoa vasta kun saavut paikalle, niin mieluisaa kämppää saat jo etsimällä etsiä. Vuokrataso on edullinen, mutta asumisen taso erittäin vaihteleva. Jotkin asunnot ovat todella murjuja ja jotkin ihan siistejä, vaikka hinta on sama. Neuvon kuitenkin, että ei kannata hirveän kauaksi metroa mennä, mikäli aikoo opiskella paljon ja kuljet päivittäin yliopistolle. Muutoin hyviä alueita on paljon, Amate–nimistä aluetta välttäisin. Itse asuin Macarenan lähellä San Julianin kaupunginosassa siistissä yksityiseltä vuokratussa edullisessa asunnossa. Panosta myös lämpimiin vaatteisiin. Sisätiloissa on kylmä – villasukat mukaan! Varaudu myös puutteisiin varustetasossa, meillä ei ollut esimerkiksi uunia. Kuitenkin kämppä ja kämppikset olivat tosi mukavia!",1,"minä","asunto",3.625,"2","Case=Nom|Degree=Pos|Number=Sing|PartForm=Past|VerbForm=Part|Voice=Act",0,"Asuntoa",0,"--",0
"110","--",1,"nsubj:cop","","1",222,"asunto",145,"moderni","Asunto oli tarjontaan nähden moderni ja sijainti erittäin hyvä, joskin hinta oli melko kallis alueen yleiseen hintatasoon verrattuna.","Majoituin alussa ydinkeskustassa sijaitsevassa hostellissa, sillä halusin etsiä kämpän vasta paikanpäällä. Lopulta vuokrasin huoneen keskustasta, Alfalfa-nimiseltä alueelta, Roommates Sevilla -organisaation kautta. Asunto oli tarjontaan nähden moderni ja sijainti erittäin hyvä, joskin hinta oli melko kallis alueen yleiseen hintatasoon verrattuna. Hyviäkin vaihtoehtoja olisi varmasti ollut tarjolla paljon halvemmalla, mutta halusin päästä helpolla majoituksen hankinnan suhteen, joten päädyin ottamaan ensimmäisen hyvän kämpän kyseisen organisaation kautta. Asiat Roommates Sevillan kanssa hoituivat enemmän tai vähemmän sujuvasti, mutta paikalliseen kulttuuriin suhteutettuna ihan kelvollisesti. Espanjassa asunnot eivät ole lähelläkään Suomen tasoa, joten liikoja ei kannata odottaa. Asunnot ovat erittäin kylmiä ennen todellisia helteitä, minkä vuoksi sisällä on helppo vilustua. Lämmin vesi ei myöskään ole itsestäänselvyys, ja melko isokokoiset torakat saattavat olla riesana ilmojen lämmitessä. Monet muutkin pienet asiat saattavat olla erittäin vanhanaikaisia suomalaiseen asumiseen verrattuna. Kannattaa myös muistaa, että Espanjassa sähkö maksaa melko paljon, ja se saattaakin muodostaa ison osan kokonaisvuokrasta.",3,"moderni","asunto",2.64102564102564,"5","Case=Nom|Degree=Pos|Number=Sing",4,"Asunto",2.8,"--",0
"111","Sing.1",1,"dobj","","1",223,"asunto",110,"hankkia","Asunnon hankin vasta saavuttuani paikan päälle.","Asunnon hankin vasta saavuttuani paikan päälle. Löysin sen yliopistolla olleiden ilmoitusten perusteella yksityiseltä vuokranantajalta. Vuokrataso Sevillassa on selkeästi Tampereen tasoa alhaisempi, mutta myös asuntojen taso on usein huonompi. Myös yliopistolta on mahdollista vuokrata huone asuntolasta, mutta se tulee todennäköisesti kalliimmaksi kuin yksityiseltä vuokraaminen. Huoneet asuntoloissa ovat pieniä ja keittiöt yhteisiä muiden kanssa. Lisäksi asuntolat sijaitsevat kaukana keskustasta joko yliopistolla tai huonoilla asuinalueilla yliopiston ja keskustan välillä. Yliopistolla oli myös jotain projekteja, joiden kautta pystyi hakemaan ilmaista asumista jonkun ohjelmaan osallistuvan vanhuksen asunnossa. Asumisen vastapalveluksena kuuluu auttaa vanhusta tiettyjen sääntöjen mukaisesti. Joillakin paikallisilla koulukavereillani oli tällainen asunto ja he olivat järjestelyyn tyytyväisiä. Useimmat kuitenkin asuivat yksityisiltä vuokratuissa asunnoissa tai vanhempiensa kotona.",1,"hankkia","asunto",3.33333333333333,"2","Mood=Ind|Number=Sing|Person=1|Tense=Pres|VerbForm=Fin|Voice=Act",11,"Asunnon",10,"1p",0
"112","--",1,"nsubj:cop","","1",224,"asua#järjestely",127,"sirkus","Asumisjärjestelyt olivat vaihdon aikana paljon puhuttu sirkus, kun jatkuvasti joku muutti paikasta toiseen erinäisistä syistä.","Asumisjärjestelyt olivat vaihdon aikana paljon puhuttu sirkus, kun jatkuvasti joku muutti paikasta toiseen erinäisistä syistä. Näissä asioissa ei kannattanut olla liian sinisilmäinen tai nirso. Itse onnistuin sattuman kautta löytämään sopivan asunnon Airbnb:n välityksellä jo Suomesta käsin. Kontaktoin vuokraemäntäni kuitenkin ilman kyseistä palvelua ja teimme avoimen kirjallisen vuokrasopimuksen hintaan 240€/kk +150€ takuu. Minulla oli kaksi kämppistä, jotka vaihtuivat vähän väliä. Minulla oli myös oma huone. Tietyistä mukavuuksista jouduin kuitenkin luopumaan, kuten tarpeeksi pitkä sänky ja lämmin vesi suihkussa minuutin jälkeen. Vesi oli juomakelpoista, vaikka maistuikin vähän erilaiselta suomalaiseen kraanaveteen nähden. Sevillassa asumisessa on hyvä huomioida, että suurinta osaa rakennuksista ei ole tiivistetty tuplaikkunoilla ja kunnollisilla eristeillä, kuten suomessa, vaan erityisesti loppusyksyn viileät yöt pudottavat sisälämpötilan hyvinkin alhaisiin lukemiin. Omassa huoneessani oli kivilattia, joka hohkasi kylmää yllättävänkin paljon.",1,"sirkus","asua#järjestely",2.8,"7","Case=Nom|Number=Sing",2,"Asumisjärjestelyt",1.6,"--",0
"113","Sing.3",1,"nmod",";asunto","5",225,"asua",167,"käydä","Minulla kävi hyvä tuuri asumisen kanssa, sillä minua odotti asunto valmiina Sevillassa.","Minulla kävi hyvä tuuri asumisen kanssa, sillä minua odotti asunto valmiina Sevillassa. Löysin muutaman tytön, jotka olivat olleet Sevillassa jo ensimmäisen lukukauden ja he etsivät uutta kämppistä. Kannattaa siis liittyä Facebookin Erasmus Sevilla ryhmiin jo hyvissä ajoin ja seurata ilmoituksia. Vuokrataso on Sevillassa erittäin edullinen. Vertailun vuoksi, asuin itse neljän makuuhuoneen tilavassa asunnossa hyvällä sijainnilla lähellä metroa ja vuokramme oli 225e per asukas. Toki kannattaa ottaa huomioon, että sähkö ja kaasu ovat todella kalliita Espanjassa ja niihin saattoikin mennä n. 40e kuussa. Toinen hyvä tapa löytää asunto on vierailla Roommates Sevilla organisaation toimistossa ja hakea asuntoa sieltä. Usein asunnon saa jo samana päivänä. Toinen organisaatio on Roomsevilla, jolla on myös paljon asuntoja tarjolla, mutta monilla on ollut ongelmia saada takuuvuokra takaisin, joten suosittelen hankkimaan asunnon jotakin muuta kautta. Kaupungissa on todella paljon tyhjillään olevia asuntoja, joista ilmoitetaan parvekkeilla olevin kyltein. Jos kielitaitosi on tarpeeksi hyvä, voit soitella suoraan ilmoituksissa oleviin numeroihin ja kysellä näyttöä. Kaikilla kavereillani onnistui asunnon saanti kuitenkin erittäin hyvin, joten siitä ei kannata stressata.",1,"käydä","minä",3.08333333333333,"2","Mood=Ind|Number=Sing|Person=3|Tense=Past|VerbForm=Fin|Voice=Act",12,"Minulla",7.2,"3p",7
"114","--",1,"dobj",";asuin","1",226,"asunto",135,"katsoa","Asunnon olin katsonut jo etukäteen ja asuin kahden muun vaihtaritytön kanssa Sevillan keskustassa.","Asunnon olin katsonut jo etukäteen ja asuin kahden muun vaihtaritytön kanssa Sevillan keskustassa. Facebookissa on lukuisia ryhmiä Sevillan erasmus-opiskelijoille, joissa tulevat vaihtarit etsivät kämppäkavereita. Sevillassa on myös huoneen välitysfirmoja kuten Roommates Sevilla, jonka kautta hankin huoneen kevätlukukaudelle. Asuin molemmat lukukaudet Prado de San Sebastianissa. Voin suositella aluetta lämpimästi, se on vain muutaman askeleen päässä metrosta sekä ydinkeskustasta. Pyörää en tarvinnut koko vuotenani, koska asuinpaikkani oli niin keskeinen. Espanjalaiset asunnot eivät vastaa suomalaista tasoa ja kosteusongelmia on monissa huoneistoissa. Asunnoissa ei myöskään ole lämmitystä, joten talvikuukausina sisällä todellakin on kylmempi kuin ulkona. Monet vuokranantajat kuitenkin hankkivat erillisen lämmittimen pyydettäessä. Suosittelenkin asumaan asunnossa, jossa on ilmastointi, jonka saa kesällä viileälle ja talvella lämpöiselle! Syyslukukauden huoneesta maksoin 300e plus vesi ja sähkö, mikä on espanjan hintatasoon nähden aika paljon, mutta asunto oli erinomaisessa kunnossa. Kevätlukukauden huoneesta maksoin 280e.",1,"katsoa","asunto",2.84615384615385,"3","Case=Nom|Degree=Pos|Number=Sing|PartForm=Past|VerbForm=Part|Voice=Act",9,"Asunnon",6.7,"--",6
