"","headverb_person","number_of_paragraphs","asuminen_expressed","indicatorword_token","indicatorloc","textid","indicatorword","words_total","headverb_lemma","sentence","paragraph","sentence_number","head_of_indicator","first_word_of_sentence_lemma","featmean","head_of_indicator_loc","headverb_feat","indicatorwords","first_word_of_sentence_token","indicator_ratio","headverb_person_simple","indicatorword_length"
"197","Plur.1",1,"dobj","","14",421,"asunto",162,"varata","Varasimme halvan hotellin yliopiston läheltä vajaaksi viikoksi ja toisena päivänä aloimme etsimään vuokrattavaa asuntoa yleisiltä markkinoilta.","Me olimme päättäneet olla ottamatta Fudanin tarjoamaa dormi-majoitusta. Dormit ovat varsin ylihintaisia ottaen huomioon, mitä ne sisältävät. Lisäksi niissä oli vikana se, että koko lukukausi (puoli vuotta) piti maksaa kerralla – näin ollen vaihto-oikeutta ei ole. Varasimme halvan hotellin yliopiston läheltä vajaaksi viikoksi ja toisena päivänä aloimme etsimään vuokrattavaa asuntoa yleisiltä markkinoilta. Kiinassa kannattaa varautua siihen, että paikalliset saavat aina halvempaa kuin länsimaalaiset – näin myös asunnoissa. Smart Shanghai on tietääkseni ainoa englanniksi asuntoja tarjoava sivusto (http://www.smartshanghai.com/housing/). Se on muutenkin kätevä sivusto ravintoloiden, ostospaikkojen, nähtävyyksien yms. etsimiseen. Mikäli päätät vuokrata asunnon yksityiseltä, kannattaa ensin löytää joku paikallinen opiskelija (kuten esimerkiksi koulun järjestämä budy, meillä tuutori), joka auttaa sinua vuokrasopimuksen tekemisessä. Tulet huomaamaan, että moni asia hoituu huomattavasti helpommin, nopeammin ja halvemmin, kun mukanasi on joku puhuu sujuvasti kiinaa. Mikäli katsot asuntoja etukäteen, älä kuitenkaan koskaan tee sopimusta ennen asunnon näkemistä. Tämä on Suomessakin hyvä ohje, mutta Kiinassa vielä paljon tärkeämpää. Älä siis osta sikaa säkissä, vaan käy asuntoesittelyssä ennen sopimuksen allekirjoitusta.",4,"etsiä","varata",3.13725490196078,"12","Mood=Ind|Number=Plur|Person=1|Tense=Past|VerbForm=Fin|Voice=Act",6,"Varasimme",3.7,"1p",0
"198","Sing.3",1,"nsubj","","2",422,"asun#tola",21,"sijaita","Fudanin asuntola vaihto-opiskelijoille sijaitsee pohjoiskampuksen luoteisimmassa nurkassa, noin kilometrin( ehkä? ) päässä tärkeimmästä hallinto- ja opetusrakennuksesta, Guanghua Lousta.","Fudanin asuntola vaihto-opiskelijoille sijaitsee pohjoiskampuksen luoteisimmassa nurkassa, noin kilometrin (ehkä?) päässä tärkeimmästä hallinto- ja opetusrakennuksesta, Guanghua Lousta. Asuntola on 23-kerroksinen jätti, jonka aulassa on päivystys 24 tuntia vuorokaudessa sekä pieni kauppa, josta saa mm. pikkupurtavaa, valmisruokia sekä joitain perustarvikkeita aamusta iltaan. Asuntola ja sen huoneet ovat siistejä, joskin askeettisia eikä niissä ole lämmitystä. Talvisaikaan ilmastointilaite ei ole usein tarpeeksi ja joissain huoneissa ikkunat ja/tai ovi falskaavat kylmää ilmaa. Kuuma vesi tulee vedenlämmittimen kautta, ja sitä riittää noin viiden minuutin yhtäjaksoiseen suihkutteluun. Internetiä ei saa suoraan, vaan se pitää käydä hankkimassa alakerran marketista. Wi-fi –reitittimen haluajien kannattaa ostaa se heti kun mahdollista, sillä ne myydään äkkiä loppuun heti lukukauden alussa.",1,"sijaita","Fudanin",2.17647058823529,"4","Mood=Ind|Number=Sing|Person=3|Tense=Pres|VerbForm=Fin|Voice=Act",0,"Fudanin",0,"3p",0
"199","--",1,"nmod","","1",423,"asun#tola",129,"hyvä","Asuntolassa olot ovat melko hyvät, vaihto-opiskelijat saavat omat huoneet, joissa tilaa on yhdelle hengelle enemmän kuin tarpeeksi( Vertailun vuoksi paikalliset opiskelijat jakavat saman kokoisen huoneen kolmen muun opiskelijan kanssa) .","Yliopisto sijaitsee kaupungin pohjoisosassa University Townissa aidatulla alueella, josta löytyy kolme yliopistoa, Peking University, Tsinghua University ja Harbin Institute of Technology. Asuntolassa olot ovat melko hyvät, vaihto-opiskelijat saavat omat huoneet, joissa tilaa on yhdelle hengelle enemmän kuin tarpeeksi (Vertailun vuoksi paikalliset opiskelijat jakavat saman kokoisen huoneen kolmen muun opiskelijan kanssa). Huoneessa on oma länsimaalainen vessa ja suihku. Vuokrataso on halpa, muistaakseni maksoin koko lukukaudesta noin 750 euroa. Jos jostain on pakko etsiä moitittavaa, niin yhteisen keittiön puuttuminen oli monen mielestä miinus. Halutessaan voi kuitenkin ostaa huoneeseensa keittolevyn ja jääkaapin, jos tuntuu että ilman niitä ei pärjää. Itse en noita kokenut tarpeelliseksi, kun alakerrasta löytyi yliopiston kanttiini, pizzeria, subway ja kaksi muuta ravintolaa. Jos niihin kyllästyy, niin 10 minuutin pyörämatkan päästä löytyy Pingshan-niminen urbaani kylä, josta löytyy katuruokaa ja ravintoloita.",2,"hyvä","asun#tola",2.56,"5","Case=Nom|Degree=Pos|Number=Plur",1,"Asuntolassa",0.8,"--",0
"200","Sing.1",3,"root",";asuntolassa","2",427,"asua",80,"asua","Itse asuin yliopiston kampuksen asuntolassa omassa huoneessa.","Itse asuin yliopiston kampuksen asuntolassa omassa huoneessa. Asuntola oli hitusen hinnakas, mutta toisaalta sijainti oli erinomainen, koska luentosalit ja muut yliopiston palvelut olivat aivan vieressä. Ewhan upea kampusalue itsessään on yksi Soulin suosittuja nähtävyyksiä ja siellä näkyykin usein turisteja kameroiden kanssa. Kampusalue on valtava ja itse kampukselta löytyy lähemmäs kymmenen eri ravintolaa, joista saa ruoan halvimmillaan kahdella eurolla. Kampuksella on myös monenlaista eri liikuntamahdollisuutta jalkapallokentästä kuntosaliin ja uima-altaaseen, sekä pari convenience storea, pankki, kirjakauppa, sekä paljon muuta myymälää ja palvelua.",1,"","itse",2.57142857142857,"2","Mood=Ind|Number=Sing|Person=1|Tense=Past|VerbForm=Fin|Voice=Act",3,"Itse",3.8,"1p",12
"201","Plur.3",1,"nsubj","","1",430,"asunto",98,"olla","Asunnot olivat vaihtareille valmiina, mutta saimme muuttaa niihin sisään vasta juuri ennen lukukauden alkua ja jouduimme lähtemään niistä heti seuraavana päivänä lukukauden päättymisestä.","Asunnot olivat vaihtareille valmiina, mutta saimme muuttaa niihin sisään vasta juuri ennen lukukauden alkua ja jouduimme lähtemään niistä heti seuraavana päivänä lukukauden päättymisestä. Ennen saapumista saimme jo Suomesta käsin täyttää asuntohakemukset ja esittää toiveitamme asumistyyppiin liittyen. Kampuksella olevassa asuntolassa on niin sanottu kotiintuloaika, joten kannattaa miettiä tarkkaan haluaako asua kampuksen sisällä vaiko hiukan kalliimmassa kampuksen ulkopuolella olevassa asuntolassa, jossa on enemmän vapauksia. Kannattaa olla siis ajoissa liikkeellä asuntolapaperien suhteen, ne lähetetäänkin yleensä samassa vaihtohakupaperien kanssa. Tätä varten tulee myös käydä lääkärintarkastuksessa YTHS:llä. Vuokrataso ei mielestäni eroa paljoa TOASin soluasuntojen vuokrasta, mutta asuntola tulee maksaa heti lukukauden alussa kerralla.",1,"olla","asunto",2.65217391304348,"2","Mood=Ind|Number=Plur|Person=3|Tense=Past|VerbForm=Fin|Voice=Act",5,"Asunnot",5.1,"3p",0
"202","Sing.1",2,"root",";asunnontarjoajalla","4",431,"asua",76,"asua","Paikan päällä Koreassa asuin itse yksityisellä asunnontarjoajalla.","Paikan päällä Koreassa asuin itse yksityisellä asunnontarjoajalla. Päädyin tulokseen katsottuani läpi Kookminin asuntolan sääntöjä ja vaatimuksia, joihin sisältyi muun muassa kotiintuloajat sekä huonosta käytöksestä saatavat miinuspisteet, jotka voivat johtaa asuntolasta ulos potkimiseen. Vaikka kovin myöhäisiä öitä ulkona minulle kertyikin Koreassa vähän, ei omillaan vuosia asuneena houkuttanut ajatus tupatarkastuksista ja siitä, että kotiin ei voisi tulla koska vain. Koulun asuntoloissa asuville halvan vuokran päälle tulee kuitenkin parin viikon välein maksettava utility-maksu, joka sisältää veden ja sähkön käytön.",1,"","paikka",2.42857142857143,"4","Mood=Ind|Number=Sing|Person=1|Tense=Past|VerbForm=Fin|Voice=Act",6,"Paikan",7.9,"1p",19
"203","Sing.3",3,"nsubj",";asuntolan","8",432,"asun#tola",42,"olla","Kuten aiemmin jo mainitsin, yliopiston alueella oli asuntola, joka oli todella edullinen ja johon oli vaihto-opiskelijoille varattu optio, jos asuntolan hallintoon ilmoitti ajoissa.","Kuten aiemmin jo mainitsin, yliopiston alueella oli asuntola, joka oli todella edullinen ja johon oli vaihto-opiskelijoille varattu optio, jos asuntolan hallintoon ilmoitti ajoissa. Maksu yhden lukukauden ajalta oli noin 250 dollaria, mutta loma-aikojen asumisesta piti maksaa lisää, noin 5 dollaria per päivä.",1,"olla","kuten",2.8695652173913,"7","Mood=Ind|Number=Sing|Person=3|Tense=Past|VerbForm=Fin|Voice=Act",3,"Kuten",7.1,"3p",10
"204","Sing.1",2,"root",";asuntolassa","1",434,"asua",127,"asua","Asuin suomalaisen ystäväni kanssa kampuksella yliopiston asuntolassa eli dormissa.","Asuin suomalaisen ystäväni kanssa kampuksella yliopiston asuntolassa eli dormissa. Vaihtoehtona oli myös URSeoul-niminen yksityinen asuntola kampuksen ulkopuolella, mutta hinnan (noin 2 100 e/hlö/lukukausi) ja sijainnin vuoksi emme nähneet sitä dormia parempana vaihtoehtona. Mahdollista on toki myös vuokrata asunto yksityiseltä, mutta tämä oli vaikeutensa vuoksi harvinaista. Jälkeenpäin ajateltuna olimmekin hyvin tyytyväisiä, että valitsimme nimenomaan yliopiston oman dormin, sillä muuten olisimme jääneet paitsi sen tarjoamasta yhteisöllisyydestä ja hyvistä etäisyyksistä. Huoneet olivat kompakteja kahden hengen huoneita ja tytöt ja pojat oli eroteltu eri siipiin. Petivaatteet ja muut yleistarvikkeet tilasin etukäteen TOWNUS-nimisestä palvelusta, jota meille yliopiston puolesta sähköpostitse tarjottiin. Palvelun kautta voi hankkia myös paikallisen puhelinliittymän, mutta ainakaan oma liittymäni ei tukenut suurinta osaa kaupungin julkisista wifi-verkoista (joita on kaupunkialueella kaikkialla), joten suosittelen hankkimaan paremman liittymän vasta saavuttua Souliin.",1,"","asua",2.55555555555556,"1","Mood=Ind|Number=Sing|Person=1|Tense=Past|VerbForm=Fin|Voice=Act",4,"Asuin",3.1,"1p",12
"205","Sing.1",1,"xcomp",";asuntolassa","6",435,"asua",114,"päättää","Kuten jo aiemmin mainitsin, päätin asua yliopiston asuntolassa, joka on kampuksen sisäpuolella.","Kuten jo aiemmin mainitsin, päätin asua yliopiston asuntolassa, joka on kampuksen sisäpuolella. Gonzaga tarjosi kahden hengen huoneita edulliseen hintaan ja minulla oli positiivisia kokemuksia asuntolasta edelliseltä oleskelultani. Asuntola on rakennettu 2000-luvun loppupuolella ja on hyvässä kunnossa. Asuntola tarjosi kaiken tarvittavan pyykkituvista ja salista ruokalaan ja huoneissa oli ilmastointi. Asuntolassa oli curfew, mutta tämä ei juuri haitannut asumistani. Vaihto-opiskelijoille tämä tarkoitti vain tulemista kotiin ennen kello viittä aamulla ja vaatimusta tehdä ilmoitus netissä, jos aikoi yöpyä muualla. Soulissa on tarjolla paljon erilaisia majoitusvaihtoehtoja, mutta hyvän paikan löytäminen netin välityksellä voi olla hyvin vaikeaa, jos ei tunne ketään maassa tai puhu Koreaa. Lisäksi ulkomaalaisilta saatetaan pyytää korkeampia hintoja. Asuntolan tasoista majoitusta ei ole saatavilla samaan hintaan.",1,"päättää","kuten",3,"5","Mood=Ind|Number=Sing|Person=1|Tense=Past|VerbForm=Fin|Voice=Act",7,"Kuten",6.1,"1p",12
"206","--",1,"dobj",";asuntola","2",438,"asua",206,"organisoida","Opiskelijoille asuminen oli organisoitu dormiin nimeltä Gonzaga hall. Sijainniltaan asuntola oli kampuksen sisäreunalla ja hyvällä sijainnilla monellakin tapaa.","Opiskelijoille asuminen oli organisoitu dormiin nimeltä Gonzaga hall. Sijainniltaan asuntola oli kampuksen sisäreunalla ja hyvällä sijainnilla monellakin tapaa. Asumisen järjestäminen muualta olisi ollut hieman työläämpää, koska vuokramarkkinat ovat ulkomaalaisille haasteellisempia. Usein esim. joutuu maksamaan korkeampaa vuokraa tai vaihtoehtoisesti maksamaan vuokranvakuuden, joka saattoi olla tuhansia euroja. Jos olisin opiskellut vuoden tai pidempään olisin hankkinut oman asunnon tai huoneen, mutta lyhyeksi aikaa 4-6kk dormiasuminen oli hyvä ja helppo vaihtoehto. Asuntolassa oli lähes kaikki paikalliseen opiskelukulttuuriin liittyvät palvelut kuten esim. ruokala, jossa tarjottiin suhteellisen edullinen aamiainen ja illallinen. Itse söin illallisen noin 1-2 kertaa viikossa, mikä oli mukava asia, kun ei jaksanut tai ehtinyt lähteä muualle syömään. Asuntolassa oli edullinen itsepalvelupesula, pienehkö kuntosali, jääkaapit ja vesiautomaatit kerroksittain, ulkopuolella 24h auki oleva kauppa. Näitä palveluita tuli hyödynnettyä paljon. Asuntolan vuokra oli suhteellisen korkeahko, mutta asuntola oli laadukas. Joillekin huonekaverin läsnäolo saattoi olla haastavaa, yksityisyyden puuttumisen vuoksi, mutta siihen tottui ja huonekaverista sai hyvän kaverin helposti. Itse valitsin ulkomaalaisen opiskelijan, koska paikalliset saattoivat opiskella liiankin ahkeraan ja suomalaista huonekaveria en halunnut. Lopulta sain koreankiinalaisen huonekaverin. Joillekin dormin säännöt saattoivat tuottaa hankaluuksia, koska siellä oli eräänlainen kotiintuloaika eikä yöllä saanut poistua ilman miinuspisteitä, mutta minä en sitä sen suuremmin huomioinut eikä se kenellekään tuottanut ongelmia. Internetistä löytyy myös paljon välittäjiä vapaille markkinoille.",1,"organisoida","opiskelija",3.05555555555556,"4","Case=Nom|Degree=Pos|Number=Sing|PartForm=Past|VerbForm=Part|Voice=Pass",8,"Opiskelijoille",3.9,"--",9
"207","Sing.3",2,"nmod",";asuntolassa","1",439,"asunto",81,"olla","Asuntonani oli kahden hengen kesken jaettu huone Sogangin asuntolassa Gonzaga Hallissa.","Asuntonani oli kahden hengen kesken jaettu huone Sogangin asuntolassa Gonzaga Hallissa. Kaikille asuntolaelämä ei sovi, mutta itse olin järjestelyyn tyytyväinen. Asuntoa haettiin lokakuussa muun paperisodan yhteydessä. Minkäänlaista vahvistusta asunnon saamisesta ei minulle tullut, eli ilmeisesti käytännössä jokainen hakija hyväksytään. Myös kampuksen ulkopuolella olisi ollut tarjolla paljon erilaisia asumisvaihtoehtoja, mikäli huoneen jakaminen ei olisi innostanut, mutta totesin lukukauteni aikana, että asuntolassa asuessa tutustui parhaiten muihin vaihtareihin. Slovakialainen kämppikseni osoittautui loistotyypiksi ja sain hänestä hyvän ystävän, joten olen erittäin tyytyväinen valintaani asua Gonzagassa.",1,"olla","asunto",2.81818181818182,"2","Mood=Ind|Number=Sing|Person=3|Tense=Past|VerbForm=Fin|Voice=Act",7,"Asuntonani",8.6,"3p",12
"208","Sing.1",1,"root",";asuntolassa","1",440,"asua",94,"asua","Asuin yliopiston asuntolassa, jossa jaoin huoneen saksalaisen vaihtarin kanssa.","Asuin yliopiston asuntolassa, jossa jaoin huoneen saksalaisen vaihtarin kanssa. Asuntolan säännöt saattavat suomalaiseen itsenäisyyteen tottuneelta tuntua hieman holhoavilta. Kanditason opiskelijoilla on kotiintuloaikoja, parin viikon välein on siisteystarkastuksia, toisen sukupuolen kerroksiin ei ole menemistä, asuntolaan pääsee vain kulkukortilla sisään jne. Sääntöjen noudattamisesta valvottiin penalty point systeemillä, josta ei kuitenkaan kannata ottaa liikaa stressiä. Jos ei lähestulkoon tulipaloa saa asuntolassa aikaiseksi, ei hädän päivää ole. Sääntöjen vastapainona asuntola on erittäin siisti ja rauhallinen. Kellarikerroksesta löytyy pesutupa, pieni kuntosali sekä ruokala, jossa tarjotaan aamiainen ja illallinen. Asuntola on kampusalueella, josta on viiden minuutin kävelymatka kaikkiin yliopiston rakennuksiin.",1,"","asua",3,"1","Mood=Ind|Number=Sing|Person=1|Tense=Past|VerbForm=Fin|Voice=Act",7,"Asuin",7.4,"1p",12
"209","Sing.3",1,"nsubj",";asuntolasta","1",441,"asua",61,"järjestyä","Asuminen järjestyy varsin kivuttomasti ja suhteellisen edullisesti kampuksella sijaitsevasta asuntolasta.","Asuminen järjestyy varsin kivuttomasti ja suhteellisen edullisesti kampuksella sijaitsevasta asuntolasta. Sääntöjä toki asuntolassa riittää, mutta vaihto-opiskelijoille ne eivät tuntuneet pätevän ihan samalla laajuudella kuin korealaisille opiskelijoille. Asuntolan yhteydessä sijaitsee myös ruokala, jossa voi enemmän tai vähemmän edullisesti nauttia aamiaista ja illallista. Henkilökohtaisesti en suosittele kyseisen ruokalan antimia, joita voi kyllä käydä myös myöhemmin nautiskelemassa erillishintaan, vaikka ei ""ruokasuunnitelmaa"" asunnon yhteydessä ottaisikaan.",1,"järjestyä","asua",2.4,"2","Mood=Ind|Number=Sing|Person=3|Tense=Pres|VerbForm=Fin|Voice=Act",5,"Asuminen",8.2,"3p",12
"210","Sing.1",1,"nmod:poss","","9",448,"asunto",59,"hoitaa","Edellä mainitun lisäksi hoidin jo Suomessa ollessani itselleni asunnon Ateenasta.","Edellä mainitun lisäksi hoidin jo Suomessa ollessani itselleni asunnon Ateenasta. Käytin paikallisen ESN:n kanssa yhteistyötä tekevän Stay in Athensin palveluja. Asunnon varaaminen ja maksaminen sujuivat mutkattomasti ja luotettavasti. En osaa sinällään sanoa onko järkevämpää varata asunto jo Suomesta käsin, vai mennä paikan päälle ilman asuntoa katselemaan eri vaihtoehtoja. Itse halusin varata hyvissä ajoin, ettei asiasta tarvitsisi sen enempiä stressata.",1,"Ateena","edellä",3.3,"10","Mood=Ind|Number=Sing|Person=1|Tense=Past|VerbForm=Fin|Voice=Act",4,"Edellä",6.8,"1p",0
"211","--",1,"nmod:gobj","","1",449,"asunto",5,"helppo","Asunnon hankkiminen oli helppoa vaihtareille tarkoitetun StayInAthens -järjestön kautta.","Asunnon hankkiminen oli helppoa vaihtareille tarkoitetun StayInAthens -järjestön kautta. Asuntoja pystyi selaamaan netissä ja valitsemaan mieluisensa suhteellisen laajasta tarjonnasta. Hyvänä puolena StayInAthensissa on sen helppous ja ehdottomasti sen asuntojen keskeiset sijainnit yliopistojen lähellä sekä niiden keskittyminen muiden erasmus-asuntojen kanssa. StayInAthensin kämpät muodostivatkin vaihtarikommuuneja, joissa suurin osa illanvietoista tapahtui. Miinuspuolena voidaan katsoa niiden korkeaa hintaa sekä huonoa kuntoa. Asunnon suhteen annan kuitenkin kaksi tärkeää vinkkiä, hanki asunto, jossa on ilmastiointi ja parveke/kattoterassi. Jos et halua paleltua talvella ja hikoilla kesää on ilmastointi ehdottoman tärkeä miellyttävän elämän kannalta. Parveke tai kattoterassi on taas eritäin hyödyllinen auringonottoon ja muuhun hengailuun kämppiksien kanssa.",1,"hankkia","asunto",3,"2","Case=Par|Degree=Pos|Number=Sing",0,"Asunnon",0,"--",0
"212","Sing.1",2,"nmod","","11",450,"asunto",15,"olla","Olin ensimmäisen yön hotellissa ja seuraavana päivänä sain avaimet omaan asuntooni.","Saapuminen Kreikkaan sujui myös hyvin. Olin ensimmäisen yön hotellissa ja seuraavana päivänä sain avaimet omaan asuntooni. Olin katsonut kämpän jo etukäteen netistä Thessaloniki student housing -verkkosivulta. Järjestö on luotettava ja kämpät suhteellisen siistejä, mutta hinnat ovat paikalliseen hintatasoon korkeita. Maksoin yksiöstä kuussa 350 euroa ja käyttömaksuja tuli kahdelle kuukaudelle n. 150 euroa. Sähkö maksaa Kreikassa enemmän kuin Suomessa ja talviaika nosti tietysti lämmityksen hintaa. Vuokra maksettiin luonnollisesti käteisellä.",2,"saada","olla",2.9375,"8","Mood=Ind|Number=Sing|Person=1|Tense=Past|VerbForm=Fin|Voice=Act",0,"Olin",0,"1p",0
"213","Sing.1",1,"dobj",";asuntoa","3",453,"asunto",10,"saada","Sain alivuokrattua asuntoni, mutta Kyprokselta en hankkinut asuntoa ennen sinne saapumistani.","Lähtövalmisteluihini kuului matkavakuutuksen hankkiminen pidennetylle ajalle, sillä jatkuva matkavakuutus kattoi vain kolmen kuukauden yhtäjaksoisen matkan. Sain alivuokrattua asuntoni, mutta Kyprokselta en hankkinut asuntoa ennen sinne saapumistani. Olin kuullut aiempana lukukautena Kyproksella vaihdossa olleelta kaverilta, että asuntoja löytyy paikanpäältä varsin helposti. Lisäksi halusin ensin tutustua kaupunkiin ja mahdollisuuksien mukaan valikoida asuinpaikan sijainnin, kun tiesin, missäpäin kaupunkia mitäkin on. Asuin ensimmäiset kolme yötä yliopiston suosittelemassa nuorisohostellissa Nikosian vanhassa kaupungissa ja hostellissa tapasin muita vaihto-opiskelijoita, jotka olivat aiemmin saapuneet kaupunkiin, löytäneet asunnon ja kuulleet, että samassa rakennuksessa olisi joku ilman kämppäkaveria. Otin tähän henkilöön yhteyttä ja tulimme juttuun. Asunto sijaitsi hyvällä paikkaa ja vuokrakin oli kohtuullinen. Yleisesti ottaen vuokrat ovat Suomeen verratuna varsin edullisia. Olin tyytyväinen ratkaisuun, sillä pystyin vaikuttamaan paremmin asuinsijaintiini kuin olisin pystynyt, jos olisin hakenut asuntoa yliopiston kautta: yliopistolla on kaksi kampusta ja omat opintoni olivat kaikki vanhalla kampuksella. Asuin lähellä vanhaa kampusta kävelymatka yliopistolle oli noin 10 minuuttia. Lisäksi keskustaan oli noin 15 minuutin matka, mikä tarkoitti, että kävellen pääsin liikkumaan hyvin.",2,"ali#vuokrata","saada",3.26923076923077,"2","Mood=Ind|Number=Sing|Person=1|Tense=Past|VerbForm=Fin|Voice=Act",0,"Sain",0,"1p",8
"214","Sing.3",1,"nsubj","","1",454,"asuin#paikka",92,"olla","Asuinpaikkanikin oli tiedossa jo ennen harjoittelupaikan varmistumista.","Muutto Vilnaan oli todella vaivaton, koska minulla on kaupungissa ystäviä. Asuinpaikkanikin oli tiedossa jo ennen harjoittelupaikan varmistumista. Yleisesti voin todeta, että asuntotilanne kaupungissa on ymmärtääkseni varsin hyvä. Huoneen voi vuokrata läheltä kaupungin keskustaa n. 60-200 eurolla kuussa ja pienen yksiön kuukausivuokrat liikkuvat 200-500 euron haarukassa. On syytä huomauttaa, että vastaavasti asuntojen kunnot ovat yleisesti ottaen huonolla tasolla.  Matkustin Vilnaan Air Balticin siivillä Helsinki-Vantaalta. Matka-aika on noin kolme tuntia, sisältänen välilaskun Riikassa. Lennon hinta oli 120 euroa. Vilnaan on mahdollista matkustaa myös laiva ja bussi yhdistelmällä, jolloin menomatkan yhteishinnaksi tulee noin 70 euroa.",2,"olla","asuin#paikka",2.88235294117647,"2","Mood=Ind|Number=Sing|Person=3|Tense=Past|VerbForm=Fin|Voice=Act",2,"Asuinpaikkanikin",2.2,"3p",0
"215","Sing.3",1,"nmod:gobj","","1",455,"asunto",96,"rastia","Asunnon hakeminen oli naurettavan helppoa parin rasti ruutuun – sivun täyttämisen ansiosta.","Asunnon hakeminen oli naurettavan helppoa parin rasti ruutuun – sivun täyttämisen ansiosta. Suurin osa opiskelija-asunnoista on vaihtareille tarjolla Esch-sur-Alzetessa, josta on muutamien kilometrien matka Belvalin kampukselle, johon kaikki aineet on pikku hiljaa ilmeisesti siirtymässä. Busseilla, junalla ja pyörällä yliopistolle pääsee kätevästi 15 – 30 minuutissa. Luxiin junamatka kestää 25 minuuttia. Suosittelen ehdottomasti opiskelijaresidenssiin muuttamista, sillä siellä tutustuu parhaiten ja suurin osa bileistä pidetään kuitenkin isommissa residensseissä. Itselläni kävi harmin paikka kun muutin 12 hengen kolmikerroksiseen taloon eikä mulle osunut yhtään kämppistä ennen huhtikuuta. Oma aktiivisuus siis korostui aika runsaasti, muilla kun seuraa riitti ihan vaan keittiöön menemällä.",1,"hakea","asunto",3.18181818181818,"2","Mood=Ind|Number=Sing|Person=3|Tense=Past|VerbForm=Fin|Voice=Act",1,"Asunnon",1,"3p",0
"216","Sing.1",1,"dobj",";asunnonvälittäjä","5",459,"asunto",73,"ruveta","Rupesin hyvissä ajoin kyselemään asuntoa asunnonvälittäjä Wendyltä.","Rupesin hyvissä ajoin kyselemään asuntoa asunnonvälittäjä Wendyltä. Samoihin aikoihin tapasin kaksi muuta opiskelijaa yliopistolta, jotka olivat lähtemässä samaan kohteeseen. Toisen opiskelijan kanssa sovimme, että otamme yhteisen asunnon. Varasimme tilavan 3h, keittiö, 2 parveketta ja 2 kylppäriä Sunnyvillestä. Taisi olla vähän alle 200 e/hlö. Sunnyvillen valitsimme siksi, että sen yhteydessä oli enemmän palveluita. Sieltä löytyi mm. ravintola, parturi, pesula ja kauppa. Otimme asunnon kolmella huoneella, jotta voimme majoittaa ystäviämme, jotka olivat tulossa vierailulle.",1,"kysellä","ruveta",3.42857142857143,"4","Mood=Ind|Number=Sing|Person=1|Tense=Past|VerbForm=Fin|Voice=Act",3,"Rupesin",4.1,"1p",17
